[
  {
    "id": "file_m01",
    "project_id": "proj_marketing",
    "name": "가을캠페인_성과리포트.xlsx",
    "mime_type": "application/vnd.openxmlformats-officedocument.spreadsheetml.sheet",
    "size_bytes": 184320,
    "uploaded_by": "이도현",
    "uploaded_at": "2026-04-15T09:00:00Z",
    "note": "지난 가을 캠페인 채널별 전환 성과",
    "linked_card_ids": [
      "card_m02"
    ],
    "is_synthetic": true
  },
  {
    "id": "file_m02",
    "project_id": "proj_marketing",
    "name": "브랜드가이드_v3.pdf",
    "mime_type": "application/pdf",
    "size_bytes": 2457600,
    "uploaded_by": "박지우",
    "uploaded_at": "2026-05-20T09:00:00Z",
    "note": "슬로건이 반영된 브랜드 가이드",
    "linked_card_ids": [
      "card_m09"
    ],
    "is_synthetic": true
  },
  {
    "id": "file_m03",
    "project_id": "proj_marketing",
    "name": "런칭캠페인_기획안.pptx",
    "mime_type": "application/vnd.openxmlformats-officedocument.presentationml.presentation",
    "size_bytes": 5242880,
    "uploaded_by": "김서윤",
    "uploaded_at": "2026-04-10T09:00:00Z",
    "note": "런칭 캠페인 전체 기획안 (예산 배분표 포함)",
    "linked_card_ids": [
      "card_m01",
      "card_m07"
    ],
    "is_synthetic": true
  },
  {
    "id": "file_d01",
    "project_id": "proj_dev",
    "name": "로그저장소_검토.pdf",
    "mime_type": "application/pdf",
    "size_bytes": 1048576,
    "uploaded_by": "정우진",
    "uploaded_at": "2026-03-10T09:00:00Z",
    "note": "저장소 후보 비교 검토 자료",
    "linked_card_ids": [
      "card_d01"
    ],
    "is_synthetic": true
  },
  {
    "id": "file_d02",
    "project_id": "proj_dev",
    "name": "OpenSearch_전환_계획.pptx",
    "mime_type": "application/vnd.openxmlformats-officedocument.presentationml.presentation",
    "size_bytes": 3145728,
    "uploaded_by": "정우진",
    "uploaded_at": "2026-06-02T09:00:00Z",
    "note": "OpenSearch 전환 일정과 영향 범위",
    "linked_card_ids": [
      "card_d03"
    ],
    "is_synthetic": true
  }
]
